No.     Time           Source                Destination           Protocol Length Info
      1 0.000000       136.114.101.65        8.181.143.186         TCP      1504   443 → 48792 [ACK] Seq=1 Ack=1 Win=1320 Len=1448 TSval=3744963697 TSecr=1721843084

Frame 1: 1504 bytes on wire (12032 bits), 52 bytes captured (416 bits)
Raw packet data
Internet Protocol Version 4, Src: 136.114.101.65, Dst: 8.181.143.186
Transmission Control Protocol, Src Port: 443 (443), Dst Port: 48792 (48792), Seq: 1, Ack: 1, Len: 1448

No.     Time           Source                Destination           Protocol Length Info
      2 0.000001       220.28.114.28         215.158.114.171       TCP      1454   443 → 52924 [ACK] Seq=1 Ack=1 Win=136 Len=1398 TSval=1514554313 TSecr=3278401698

Frame 2: 1454 bytes on wire (11632 bits), 52 bytes captured (416 bits)
Raw packet data
Internet Protocol Version 4, Src: 220.28.114.28, Dst: 215.158.114.171
Transmission Control Protocol, Src Port: 443 (443), Dst Port: 52924 (52924), Seq: 1, Ack: 1, Len: 1398

No.     Time           Source                Destination           Protocol Length Info
      3 0.000004       97.182.149.55         192.205.41.230        TCP      68     52271 → 80 [ACK] Seq=1 Ack=1 Win=4096 Len=0 TSval=507643741 TSecr=450130924 SLE=1345 SRE=32257

Frame 3: 68 bytes on wire (544 bits), 64 bytes captured (512 bits)
Raw packet data
Internet Protocol Version 4, Src: 97.182.149.55, Dst: 192.205.41.230
Transmission Control Protocol, Src Port: 52271 (52271), Dst Port: 80 (80), Seq: 1, Ack: 1, Len: 0

No.     Time           Source                Destination           Protocol Length Info
      4 0.000005       220.28.114.28         215.158.114.171       TCP      1454   443 → 52924 [ACK] Seq=1399 Ack=1 Win=136 Len=1398 TSval=1514554313 TSecr=3278401698

Frame 4: 1454 bytes on wire (11632 bits), 52 bytes captured (416 bits)
Raw packet data
Internet Protocol Version 4, Src: 220.28.114.28, Dst: 215.158.114.171
Transmission Control Protocol, Src Port: 443 (443), Dst Port: 52924 (52924), Seq: 1399, Ack: 1, Len: 1398

No.     Time           Source                Destination           Protocol Length Info
      5 0.000008       220.28.114.28         215.158.114.171       TCP      1454   443 → 52924 [ACK] Seq=2797 Ack=1 Win=136 Len=1398 TSval=1514554313 TSecr=3278401698

Frame 5: 1454 bytes on wire (11632 bits), 52 bytes captured (416 bits)
Raw packet data
Internet Protocol Version 4, Src: 220.28.114.28, Dst: 215.158.114.171
Transmission Control Protocol, Src Port: 443 (443), Dst Port: 52924 (52924), Seq: 2797, Ack: 1, Len: 1398

No.     Time           Source                Destination           Protocol Length Info
      6 0.000009       109.122.181.80        133.178.226.80        TCP      469    32860 → 80 [PSH, ACK] Seq=1 Ack=1 Win=336 Len=413 TSval=1385592753 TSecr=3124456671

Frame 6: 469 bytes on wire (3752 bits), 52 bytes captured (416 bits)
Raw packet data
Internet Protocol Version 4, Src: 109.122.181.80, Dst: 133.178.226.80
Transmission Control Protocol, Src Port: 32860 (32860), Dst Port: 80 (80), Seq: 1, Ack: 1, Len: 413

No.     Time           Source                Destination           Protocol Length Info
      7 0.000011       136.114.101.65        8.181.143.186         TCP      1504   443 → 48792 [ACK] Seq=1449 Ack=1 Win=1320 Len=1448 TSval=3744963697 TSecr=1721843084

Frame 7: 1504 bytes on wire (12032 bits), 52 bytes captured (416 bits)
Raw packet data
Internet Protocol Version 4, Src: 136.114.101.65, Dst: 8.181.143.186
Transmission Control Protocol, Src Port: 443 (443), Dst Port: 48792 (48792), Seq: 1449, Ack: 1, Len: 1448

No.     Time           Source                Destination           Protocol Length Info
      8 0.000013       136.172.25.137        50.224.103.77         TCP      56     59991 → 1935 [ACK] Seq=1 Ack=1 Win=33304 Len=0 TSval=32032182 TSecr=3240466180

Frame 8: 56 bytes on wire (448 bits), 52 bytes captured (416 bits)
Raw packet data
Internet Protocol Version 4, Src: 136.172.25.137, Dst: 50.224.103.77
Transmission Control Protocol, Src Port: 59991 (59991), Dst Port: 1935 (1935), Seq: 1, Ack: 1, Len: 0

No.     Time           Source                Destination           Protocol Length Info
      9 0.000018       94.177.109.107        97.247.120.242        TCP      1504   1607 → 443 [ACK] Seq=1 Ack=1 Win=32437 Len=1460

Frame 9: 1504 bytes on wire (12032 bits), 40 bytes captured (320 bits)
Raw packet data
Internet Protocol Version 4, Src: 94.177.109.107, Dst: 97.247.120.242
Transmission Control Protocol, Src Port: 1607 (1607), Dst Port: 443 (443), Seq: 1, Ack: 1, Len: 1460

No.     Time           Source                Destination           Protocol Length Info
     10 0.000020       220.28.114.28         215.158.114.171       TCP      1454   443 → 52924 [ACK] Seq=4195 Ack=1 Win=136 Len=1398 TSval=1514554313 TSecr=3278401698

Frame 10: 1454 bytes on wire (11632 bits), 52 bytes captured (416 bits)
Raw packet data
Internet Protocol Version 4, Src: 220.28.114.28, Dst: 215.158.114.171
Transmission Control Protocol, Src Port: 443 (443), Dst Port: 52924 (52924), Seq: 4195, Ack: 1, Len: 1398

No.     Time           Source                Destination           Protocol Length Info
     11 0.000024       152.101.172.112       139.163.96.94         TCP      46     55604 → 443 [ACK] Seq=1 Ack=1 Win=16384 Len=0

Frame 11: 46 bytes on wire (368 bits), 40 bytes captured (320 bits)
Raw packet data
Internet Protocol Version 4, Src: 152.101.172.112, Dst: 139.163.96.94
Transmission Control Protocol, Src Port: 55604 (55604), Dst Port: 443 (443), Seq: 1, Ack: 1, Len: 0

No.     Time           Source                Destination           Protocol Length Info
     12 0.000025       136.114.101.65        8.181.143.186         TCP      1504   443 → 48792 [ACK] Seq=2897 Ack=1 Win=1320 Len=1448 TSval=3744963697 TSecr=1721843084

Frame 12: 1504 bytes on wire (12032 bits), 52 bytes captured (416 bits)
Raw packet data
Internet Protocol Version 4, Src: 136.114.101.65, Dst: 8.181.143.186
Transmission Control Protocol, Src Port: 443 (443), Dst Port: 48792 (48792), Seq: 2897, Ack: 1, Len: 1448

No.     Time           Source                Destination           Protocol Length Info
     13 0.000026       136.114.101.65        8.181.143.186         TCP      537    443 → 48792 [PSH, ACK] Seq=4345 Ack=1 Win=1320 Len=481 TSval=3744963697 TSecr=1721843084

Frame 13: 537 bytes on wire (4296 bits), 52 bytes captured (416 bits)
Raw packet data
Internet Protocol Version 4, Src: 136.114.101.65, Dst: 8.181.143.186
Transmission Control Protocol, Src Port: 443 (443), Dst Port: 48792 (48792), Seq: 4345, Ack: 1, Len: 481

No.     Time           Source                Destination           Protocol Length Info
     14 0.000026       220.28.114.28         215.158.114.171       TCP      1454   443 → 52924 [ACK] Seq=5593 Ack=1 Win=136 Len=1398 TSval=1514554313 TSecr=3278401698

Frame 14: 1454 bytes on wire (11632 bits), 52 bytes captured (416 bits)
Raw packet data
Internet Protocol Version 4, Src: 220.28.114.28, Dst: 215.158.114.171
Transmission Control Protocol, Src Port: 443 (443), Dst Port: 52924 (52924), Seq: 5593, Ack: 1, Len: 1398

No.     Time           Source                Destination           Protocol Length Info
     15 0.000028       220.28.114.28         215.158.114.171       TCP      1454   443 → 52924 [ACK] Seq=6991 Ack=1 Win=136 Len=1398 TSval=1514554313 TSecr=3278401698

Frame 15: 1454 bytes on wire (11632 bits), 52 bytes captured (416 bits)
Raw packet data
Internet Protocol Version 4, Src: 220.28.114.28, Dst: 215.158.114.171
Transmission Control Protocol, Src Port: 443 (443), Dst Port: 52924 (52924), Seq: 6991, Ack: 1, Len: 1398

No.     Time           Source                Destination           Protocol Length Info
     16 0.000036       140.147.46.234        192.190.62.12         TCP      46     443 → 51405 [ACK] Seq=1 Ack=1 Win=43 Len=0

Frame 16: 46 bytes on wire (368 bits), 40 bytes captured (320 bits)
Raw packet data
Internet Protocol Version 4, Src: 140.147.46.234, Dst: 192.190.62.12
Transmission Control Protocol, Src Port: 443 (443), Dst Port: 51405 (51405), Seq: 1, Ack: 1, Len: 0

No.     Time           Source                Destination           Protocol Length Info
     17 0.000042       220.28.114.28         215.158.114.171       TCP      1454   443 → 52924 [ACK] Seq=8389 Ack=1 Win=136 Len=1398 TSval=1514554313 TSecr=3278401698

Frame 17: 1454 bytes on wire (11632 bits), 52 bytes captured (416 bits)
Raw packet data
Internet Protocol Version 4, Src: 220.28.114.28, Dst: 215.158.114.171
Transmission Control Protocol, Src Port: 443 (443), Dst Port: 52924 (52924), Seq: 8389, Ack: 1, Len: 1398

No.     Time           Source                Destination           Protocol Length Info
     18 0.000045       220.28.114.28         215.158.114.171       TCP      1454   443 → 52924 [ACK] Seq=9787 Ack=1 Win=136 Len=1398 TSval=1514554313 TSecr=3278401698

Frame 18: 1454 bytes on wire (11632 bits), 52 bytes captured (416 bits)
Raw packet data
Internet Protocol Version 4, Src: 220.28.114.28, Dst: 215.158.114.171
Transmission Control Protocol, Src Port: 443 (443), Dst Port: 52924 (52924), Seq: 9787, Ack: 1, Len: 1398

No.     Time           Source                Destination           Protocol Length Info
     19 0.000047       141.179.27.82         136.54.133.133        UDP      64     25590 → 26500  Len=32[Packet size limited during capture]

Frame 19: 64 bytes on wire (512 bits), 28 bytes captured (224 bits)
Raw packet data
Internet Protocol Version 4, Src: 141.179.27.82, Dst: 136.54.133.133
User Datagram Protocol, Src Port: 25590 (25590), Dst Port: 26500 (26500)
[Packet size limited during capture: PKTGEN truncated]

No.     Time           Source                Destination           Protocol Length Info
     20 0.000052       68.206.80.25          97.247.120.243        TCP      1458   60119 → 443 [ACK] Seq=1 Ack=1 Win=16601 Len=1414

Frame 20: 1458 bytes on wire (11664 bits), 40 bytes captured (320 bits)
Raw packet data
Internet Protocol Version 4, Src: 68.206.80.25, Dst: 97.247.120.243
Transmission Control Protocol, Src Port: 60119 (60119), Dst Port: 443 (443), Seq: 1, Ack: 1, Len: 1414

No.     Time           Source                Destination           Protocol Length Info
     21 0.000054       220.28.114.28         215.158.114.171       TCP      1454   443 → 52924 [ACK] Seq=11185 Ack=1 Win=136 Len=1398 TSval=1514554313 TSecr=3278401698

Frame 21: 1454 bytes on wire (11632 bits), 52 bytes captured (416 bits)
Raw packet data
Internet Protocol Version 4, Src: 220.28.114.28, Dst: 215.158.114.171
Transmission Control Protocol, Src Port: 443 (443), Dst Port: 52924 (52924), Seq: 11185, Ack: 1, Len: 1398

No.     Time           Source                Destination           Protocol Length Info
     22 0.000059       220.28.114.28         215.158.114.171       TCP      1454   443 → 52924 [ACK] Seq=12583 Ack=1 Win=136 Len=1398 TSval=1514554313 TSecr=3278401698

Frame 22: 1454 bytes on wire (11632 bits), 52 bytes captured (416 bits)
Raw packet data
Internet Protocol Version 4, Src: 220.28.114.28, Dst: 215.158.114.171
Transmission Control Protocol, Src Port: 443 (443), Dst Port: 52924 (52924), Seq: 12583, Ack: 1, Len: 1398

No.     Time           Source                Destination           Protocol Length Info
     23 0.000060       220.28.114.28         215.158.114.171       TCP      1454   443 → 52924 [ACK] Seq=13981 Ack=1 Win=136 Len=1398 TSval=1514554313 TSecr=3278401698

Frame 23: 1454 bytes on wire (11632 bits), 52 bytes captured (416 bits)
Raw packet data
Internet Protocol Version 4, Src: 220.28.114.28, Dst: 215.158.114.171
Transmission Control Protocol, Src Port: 443 (443), Dst Port: 52924 (52924), Seq: 13981, Ack: 1, Len: 1398

No.     Time           Source                Destination           Protocol Length Info
     24 0.000061       58.134.8.165          98.150.38.226         DNS      84     [Packet size limited during capture]

Frame 24: 84 bytes on wire (672 bits), 28 bytes captured (224 bits)
Raw packet data
Internet Protocol Version 4, Src: 58.134.8.165, Dst: 98.150.38.226
User Datagram Protocol, Src Port: 5647 (5647), Dst Port: 53 (53)
[Packet size limited during capture: DNS truncated]

No.     Time           Source                Destination           Protocol Length Info
     25 0.000062       220.28.114.28         215.158.114.171       TCP      1454   443 → 52924 [ACK] Seq=15379 Ack=1 Win=136 Len=1398 TSval=1514554313 TSecr=3278401698

Frame 25: 1454 bytes on wire (11632 bits), 52 bytes captured (416 bits)
Raw packet data
Internet Protocol Version 4, Src: 220.28.114.28, Dst: 215.158.114.171
Transmission Control Protocol, Src Port: 443 (443), Dst Port: 52924 (52924), Seq: 15379, Ack: 1, Len: 1398

No.     Time           Source                Destination           Protocol Length Info
     26 0.000078       220.28.114.28         215.158.114.171       TCP      1454   443 → 52924 [ACK] Seq=16777 Ack=1 Win=136 Len=1398 TSval=1514554313 TSecr=3278401698

Frame 26: 1454 bytes on wire (11632 bits), 52 bytes captured (416 bits)
Raw packet data
Internet Protocol Version 4, Src: 220.28.114.28, Dst: 215.158.114.171
Transmission Control Protocol, Src Port: 443 (443), Dst Port: 52924 (52924), Seq: 16777, Ack: 1, Len: 1398

No.     Time           Source                Destination           Protocol Length Info
     27 0.000079       155.133.7.236         92.168.216.21         TCP      56     59806 → 80 [ACK] Seq=1 Ack=1 Win=11954 Len=0 TSval=1916319764 TSecr=261889278

Frame 27: 56 bytes on wire (448 bits), 52 bytes captured (416 bits)
Raw packet data
Internet Protocol Version 4, Src: 155.133.7.236, Dst: 92.168.216.21
Transmission Control Protocol, Src Port: 59806 (59806), Dst Port: 80 (80), Seq: 1, Ack: 1, Len: 0

No.     Time           Source                Destination           Protocol Length Info
     28 0.000080       155.133.7.236         92.168.216.21         TCP      56     59806 → 80 [ACK] Seq=1 Ack=2773 Win=11781 Len=0 TSval=1916319764 TSecr=261889279

Frame 28: 56 bytes on wire (448 bits), 52 bytes captured (416 bits)
Raw packet data
Internet Protocol Version 4, Src: 155.133.7.236, Dst: 92.168.216.21
Transmission Control Protocol, Src Port: 59806 (59806), Dst Port: 80 (80), Seq: 1, Ack: 2773, Len: 0

No.     Time           Source                Destination           Protocol Length Info
     29 0.000080       220.28.114.28         215.158.114.171       TCP      1454   443 → 52924 [ACK] Seq=18175 Ack=1 Win=136 Len=1398 TSval=1514554313 TSecr=3278401698

Frame 29: 1454 bytes on wire (11632 bits), 52 bytes captured (416 bits)
Raw packet data
Internet Protocol Version 4, Src: 220.28.114.28, Dst: 215.158.114.171
Transmission Control Protocol, Src Port: 443 (443), Dst Port: 52924 (52924), Seq: 18175, Ack: 1, Len: 1398

No.     Time           Source                Destination           Protocol Length Info
     30 0.000083       141.103.51.81         33.233.141.62         TCP      1504   1935 → 39850 [ACK] Seq=1 Ack=1 Win=123 Len=1460

Frame 30: 1504 bytes on wire (12032 bits), 40 bytes captured (320 bits)
Raw packet data
Internet Protocol Version 4, Src: 141.103.51.81, Dst: 33.233.141.62
Transmission Control Protocol, Src Port: 1935 (1935), Dst Port: 39850 (39850), Seq: 1, Ack: 1, Len: 1460

No.     Time           Source                Destination           Protocol Length Info
     31 0.000085       220.28.114.28         215.158.114.171       TCP      1454   443 → 52924 [ACK] Seq=19573 Ack=1 Win=136 Len=1398 TSval=1514554313 TSecr=3278401698

Frame 31: 1454 bytes on wire (11632 bits), 52 bytes captured (416 bits)
Raw packet data
Internet Protocol Version 4, Src: 220.28.114.28, Dst: 215.158.114.171
Transmission Control Protocol, Src Port: 443 (443), Dst Port: 52924 (52924), Seq: 19573, Ack: 1, Len: 1398

No.     Time           Source                Destination           Protocol Length Info
     32 0.000087       53.231.91.231         111.147.107.110       TCP      46     443 → 8544 [ACK] Seq=1 Ack=1 Win=3240 Len=0

Frame 32: 46 bytes on wire (368 bits), 40 bytes captured (320 bits)
Raw packet data
Internet Protocol Version 4, Src: 53.231.91.231, Dst: 111.147.107.110
Transmission Control Protocol, Src Port: 443 (443), Dst Port: 8544 (8544), Seq: 1, Ack: 1, Len: 0

No.     Time           Source                Destination           Protocol Length Info
     33 0.000087       141.103.51.81         33.233.141.62         TCP      1504   1935 → 39850 [ACK] Seq=1461 Ack=1 Win=123 Len=1460

Frame 33: 1504 bytes on wire (12032 bits), 40 bytes captured (320 bits)
Raw packet data
Internet Protocol Version 4, Src: 141.103.51.81, Dst: 33.233.141.62
Transmission Control Protocol, Src Port: 1935 (1935), Dst Port: 39850 (39850), Seq: 1461, Ack: 1, Len: 1460

No.     Time           Source                Destination           Protocol Length Info
     34 0.000089       139.69.162.23         8.181.142.35          TCP      1504   443 → 53716 [ACK] Seq=1 Ack=1 Win=1320 Len=1448 TSval=3108203720 TSecr=3655029580

Frame 34: 1504 bytes on wire (12032 bits), 52 bytes captured (416 bits)
Raw packet data
Internet Protocol Version 4, Src: 139.69.162.23, Dst: 8.181.142.35
Transmission Control Protocol, Src Port: 443 (443), Dst Port: 53716 (53716), Seq: 1, Ack: 1, Len: 1448

No.     Time           Source                Destination           Protocol Length Info
     35 0.000090       139.69.162.23         8.181.142.35          TCP      175    443 → 53716 [PSH, ACK] Seq=1449 Ack=1 Win=1320 Len=119 TSval=3108203720 TSecr=3655029580

Frame 35: 175 bytes on wire (1400 bits), 52 bytes captured (416 bits)
Raw packet data
Internet Protocol Version 4, Src: 139.69.162.23, Dst: 8.181.142.35
Transmission Control Protocol, Src Port: 443 (443), Dst Port: 53716 (53716), Seq: 1449, Ack: 1, Len: 119

No.     Time           Source                Destination           Protocol Length Info
     36 0.000090       53.203.174.180        96.112.114.50         TCP      98     443 → 60206 [PSH, ACK] Seq=1 Ack=1 Win=237 Len=54

Frame 36: 98 bytes on wire (784 bits), 40 bytes captured (320 bits)
Raw packet data
Internet Protocol Version 4, Src: 53.203.174.180, Dst: 96.112.114.50
Transmission Control Protocol, Src Port: 443 (443), Dst Port: 60206 (60206), Seq: 1, Ack: 1, Len: 54

No.     Time           Source                Destination           Protocol Length Info
     37 0.000097       37.113.160.221        137.166.16.156        TCP      46     26563 → 443 [FIN, ACK] Seq=1 Ack=1 Win=63 Len=0

Frame 37: 46 bytes on wire (368 bits), 40 bytes captured (320 bits)
Raw packet data
Internet Protocol Version 4, Src: 37.113.160.221, Dst: 137.166.16.156
Transmission Control Protocol, Src Port: 26563 (26563), Dst Port: 443 (443), Seq: 1, Ack: 1, Len: 0

No.     Time           Source                Destination           Protocol Length Info
     38 0.000098       141.103.51.81         33.233.141.62         TCP      1504   1935 → 39850 [ACK] Seq=2921 Ack=1 Win=123 Len=1460

Frame 38: 1504 bytes on wire (12032 bits), 40 bytes captured (320 bits)
Raw packet data
Internet Protocol Version 4, Src: 141.103.51.81, Dst: 33.233.141.62
Transmission Control Protocol, Src Port: 1935 (1935), Dst Port: 39850 (39850), Seq: 2921, Ack: 1, Len: 1460

No.     Time           Source                Destination           Protocol Length Info
     39 0.000108       220.28.114.28         215.158.114.171       TCP      1454   443 → 52924 [ACK] Seq=20971 Ack=1 Win=136 Len=1398 TSval=1514554313 TSecr=3278401698

Frame 39: 1454 bytes on wire (11632 bits), 52 bytes captured (416 bits)
Raw packet data
Internet Protocol Version 4, Src: 220.28.114.28, Dst: 215.158.114.171
Transmission Control Protocol, Src Port: 443 (443), Dst Port: 52924 (52924), Seq: 20971, Ack: 1, Len: 1398

No.     Time           Source                Destination           Protocol Length Info
     40 0.000111       141.103.51.81         33.233.141.62         TCP      1504   1935 → 39850 [ACK] Seq=4381 Ack=1 Win=123 Len=1460

Frame 40: 1504 bytes on wire (12032 bits), 40 bytes captured (320 bits)
Raw packet data
Internet Protocol Version 4, Src: 141.103.51.81, Dst: 33.233.141.62
Transmission Control Protocol, Src Port: 1935 (1935), Dst Port: 39850 (39850), Seq: 4381, Ack: 1, Len: 1460

No.     Time           Source                Destination           Protocol Length Info
     41 0.000113       220.28.114.28         215.158.114.171       TCP      1454   443 → 52924 [ACK] Seq=22369 Ack=1 Win=136 Len=1398 TSval=1514554313 TSecr=3278401698

Frame 41: 1454 bytes on wire (11632 bits), 52 bytes captured (416 bits)
Raw packet data
Internet Protocol Version 4, Src: 220.28.114.28, Dst: 215.158.114.171
Transmission Control Protocol, Src Port: 443 (443), Dst Port: 52924 (52924), Seq: 22369, Ack: 1, Len: 1398

No.     Time           Source                Destination           Protocol Length Info
     42 0.000114       136.114.101.65        8.181.143.186         TCP      1504   443 → 48792 [ACK] Seq=4826 Ack=1 Win=1320 Len=1448 TSval=3744963697 TSecr=1721843084

Frame 42: 1504 bytes on wire (12032 bits), 52 bytes captured (416 bits)
Raw packet data
Internet Protocol Version 4, Src: 136.114.101.65, Dst: 8.181.143.186
Transmission Control Protocol, Src Port: 443 (443), Dst Port: 48792 (48792), Seq: 4826, Ack: 1, Len: 1448

No.     Time           Source                Destination           Protocol Length Info
     43 0.000116       220.28.114.28         215.158.114.171       TCP      1454   443 → 52924 [ACK] Seq=23767 Ack=1 Win=136 Len=1398 TSval=1514554313 TSecr=3278401698

Frame 43: 1454 bytes on wire (11632 bits), 52 bytes captured (416 bits)
Raw packet data
Internet Protocol Version 4, Src: 220.28.114.28, Dst: 215.158.114.171
Transmission Control Protocol, Src Port: 443 (443), Dst Port: 52924 (52924), Seq: 23767, Ack: 1, Len: 1398

No.     Time           Source                Destination           Protocol Length Info
     44 0.000123       136.114.101.65        8.181.143.186         TCP      1504   443 → 48792 [ACK] Seq=6274 Ack=1 Win=1320 Len=1448 TSval=3744963697 TSecr=1721843084

Frame 44: 1504 bytes on wire (12032 bits), 52 bytes captured (416 bits)
Raw packet data
Internet Protocol Version 4, Src: 136.114.101.65, Dst: 8.181.143.186
Transmission Control Protocol, Src Port: 443 (443), Dst Port: 48792 (48792), Seq: 6274, Ack: 1, Len: 1448

No.     Time           Source                Destination           Protocol Length Info
     45 0.000124       152.133.172.43        92.168.216.47         TCP      56     63150 → 80 [ACK] Seq=1 Ack=1 Win=30852 Len=0 TSval=958 TSecr=649451599

Frame 45: 56 bytes on wire (448 bits), 52 bytes captured (416 bits)
Raw packet data
Internet Protocol Version 4, Src: 152.133.172.43, Dst: 92.168.216.47
Transmission Control Protocol, Src Port: 63150 (63150), Dst Port: 80 (80), Seq: 1, Ack: 1, Len: 0

No.     Time           Source                Destination           Protocol Length Info
     46 0.000130       220.28.114.28         215.158.114.171       TCP      1454   443 → 52924 [ACK] Seq=25165 Ack=1 Win=136 Len=1398 TSval=1514554313 TSecr=3278401698

Frame 46: 1454 bytes on wire (11632 bits), 52 bytes captured (416 bits)
Raw packet data
Internet Protocol Version 4, Src: 220.28.114.28, Dst: 215.158.114.171
Transmission Control Protocol, Src Port: 443 (443), Dst Port: 52924 (52924), Seq: 25165, Ack: 1, Len: 1398

No.     Time           Source                Destination           Protocol Length Info
     47 0.000131       69.150.168.10         215.158.65.37         TCP      68     37046 → 443 [ACK] Seq=1 Ack=1 Win=32494 Len=0 TSval=3113417464 TSecr=3320038625 SLE=2897 SRE=3378

Frame 47: 68 bytes on wire (544 bits), 64 bytes captured (512 bits)
Raw packet data
Internet Protocol Version 4, Src: 69.150.168.10, Dst: 215.158.65.37
Transmission Control Protocol, Src Port: 37046 (37046), Dst Port: 443 (443), Seq: 1, Ack: 1, Len: 0

No.     Time           Source                Destination           Protocol Length Info
     48 0.000132       67.240.97.177         89.183.104.130        UDP      133    52956 → 8080  Len=101[Packet size limited during capture]

Frame 48: 133 bytes on wire (1064 bits), 28 bytes captured (224 bits)
Raw packet data
Internet Protocol Version 4, Src: 67.240.97.177, Dst: 89.183.104.130
User Datagram Protocol, Src Port: 52956 (52956), Dst Port: 8080 (8080)
[Packet size limited during capture: PKTGEN truncated]

No.     Time           Source                Destination           Protocol Length Info
     49 0.000132       220.28.114.28         215.158.114.171       TCP      1454   443 → 52924 [ACK] Seq=26563 Ack=1 Win=136 Len=1398 TSval=1514554313 TSecr=3278401698

Frame 49: 1454 bytes on wire (11632 bits), 52 bytes captured (416 bits)
Raw packet data
Internet Protocol Version 4, Src: 220.28.114.28, Dst: 215.158.114.171
Transmission Control Protocol, Src Port: 443 (443), Dst Port: 52924 (52924), Seq: 26563, Ack: 1, Len: 1398

No.     Time           Source                Destination           Protocol Length Info
     50 0.000134       220.28.114.28         215.158.114.171       TCP      1454   443 → 52924 [ACK] Seq=27961 Ack=1 Win=136 Len=1398 TSval=1514554313 TSecr=3278401698

Frame 50: 1454 bytes on wire (11632 bits), 52 bytes captured (416 bits)
Raw packet data
Internet Protocol Version 4, Src: 220.28.114.28, Dst: 215.158.114.171
Transmission Control Protocol, Src Port: 443 (443), Dst Port: 52924 (52924), Seq: 27961, Ack: 1, Len: 1398

No.     Time           Source                Destination           Protocol Length Info
     51 0.000135       69.150.168.10         215.158.65.37         TCP      56     [TCP Dup ACK 47#1] 37046 → 443 [ACK] Seq=1 Ack=1 Win=32494 Len=0 TSval=3113417464 TSecr=3320038625

Frame 51: 56 bytes on wire (448 bits), 52 bytes captured (416 bits)
Raw packet data
Internet Protocol Version 4, Src: 69.150.168.10, Dst: 215.158.65.37
Transmission Control Protocol, Src Port: 37046 (37046), Dst Port: 443 (443), Seq: 1, Ack: 1, Len: 0

No.     Time           Source                Destination           Protocol Length Info
     52 0.000138       136.114.101.65        8.181.143.186         TCP      1504   443 → 48792 [ACK] Seq=7722 Ack=1 Win=1320 Len=1448 TSval=3744963697 TSecr=1721843084

Frame 52: 1504 bytes on wire (12032 bits), 52 bytes captured (416 bits)
Raw packet data
Internet Protocol Version 4, Src: 136.114.101.65, Dst: 8.181.143.186
Transmission Control Protocol, Src Port: 443 (443), Dst Port: 48792 (48792), Seq: 7722, Ack: 1, Len: 1448

No.     Time           Source                Destination           Protocol Length Info
     53 0.000139       4.122.52.188          99.181.161.182        TCP      487    62021 → 80 [PSH, ACK] Seq=1 Ack=1 Win=16614 Len=443

Frame 53: 487 bytes on wire (3896 bits), 40 bytes captured (320 bits)
Raw packet data
Internet Protocol Version 4, Src: 4.122.52.188, Dst: 99.181.161.182
Transmission Control Protocol, Src Port: 62021 (62021), Dst Port: 80 (80), Seq: 1, Ack: 1, Len: 443

No.     Time           Source                Destination           Protocol Length Info
     54 0.000142       153.175.105.2         109.91.50.218         UDP      274    1900 → 27015  Len=242[Packet size limited during capture]

Frame 54: 274 bytes on wire (2192 bits), 28 bytes captured (224 bits)
Raw packet data
Internet Protocol Version 4, Src: 153.175.105.2, Dst: 109.91.50.218
User Datagram Protocol, Src Port: 1900 (1900), Dst Port: 27015 (27015)
[Packet size limited during capture: HTTP truncated]

No.     Time           Source                Destination           Protocol Length Info
     55 0.000143       100.168.37.238        100.228.42.147        TCP      1404   62101 → 443 [ACK] Seq=1 Ack=1 Win=65535 Len=1348 TSval=4083388866 TSecr=2716576556

Frame 55: 1404 bytes on wire (11232 bits), 52 bytes captured (416 bits)
Raw packet data
Internet Protocol Version 4, Src: 100.168.37.238, Dst: 100.228.42.147
Transmission Control Protocol, Src Port: 62101 (62101), Dst Port: 443 (443), Seq: 1, Ack: 1, Len: 1348

No.     Time           Source                Destination           Protocol Length Info
     56 0.000145       220.28.114.28         215.158.114.171       TCP      1454   443 → 52924 [ACK] Seq=29359 Ack=1 Win=136 Len=1398 TSval=1514554313 TSecr=3278401698

Frame 56: 1454 bytes on wire (11632 bits), 52 bytes captured (416 bits)
Raw packet data
Internet Protocol Version 4, Src: 220.28.114.28, Dst: 215.158.114.171
Transmission Control Protocol, Src Port: 443 (443), Dst Port: 52924 (52924), Seq: 29359, Ack: 1, Len: 1398

No.     Time           Source                Destination           Protocol Length Info
     57 0.000147       4.205.239.120         92.168.217.245        TCP      56     46612 → 80 [ACK] Seq=1 Ack=1 Win=8101 Len=0 TSval=334489630 TSecr=1863431777

Frame 57: 56 bytes on wire (448 bits), 52 bytes captured (416 bits)
Raw packet data
Internet Protocol Version 4, Src: 4.205.239.120, Dst: 92.168.217.245
Transmission Control Protocol, Src Port: 46612 (46612), Dst Port: 80 (80), Seq: 1, Ack: 1, Len: 0

No.     Time           Source                Destination           Protocol Length Info
     58 0.000147       202.124.29.52         92.168.217.162        TCP      56     34013 → 80 [ACK] Seq=1 Ack=1 Win=47628 Len=0 TSval=9883464 TSecr=3631689416

Frame 58: 56 bytes on wire (448 bits), 52 bytes captured (416 bits)
Raw packet data
Internet Protocol Version 4, Src: 202.124.29.52, Dst: 92.168.217.162
Transmission Control Protocol, Src Port: 34013 (34013), Dst Port: 80 (80), Seq: 1, Ack: 1, Len: 0

No.     Time           Source                Destination           Protocol Length Info
     59 0.000147       202.124.29.52         92.168.217.162        TCP      56     34013 → 80 [ACK] Seq=1 Ack=2897 Win=47628 Len=0 TSval=9883465 TSecr=3631689420

Frame 59: 56 bytes on wire (448 bits), 52 bytes captured (416 bits)
Raw packet data
Internet Protocol Version 4, Src: 202.124.29.52, Dst: 92.168.217.162
Transmission Control Protocol, Src Port: 34013 (34013), Dst Port: 80 (80), Seq: 1, Ack: 2897, Len: 0

No.     Time           Source                Destination           Protocol Length Info
     60 0.000147       202.124.29.52         92.168.217.162        TCP      56     34013 → 80 [ACK] Seq=1 Ack=5793 Win=47628 Len=0 TSval=9883465 TSecr=3631689420

Frame 60: 56 bytes on wire (448 bits), 52 bytes captured (416 bits)
Raw packet data
Internet Protocol Version 4, Src: 202.124.29.52, Dst: 92.168.217.162
Transmission Control Protocol, Src Port: 34013 (34013), Dst Port: 80 (80), Seq: 1, Ack: 5793, Len: 0

No.     Time           Source                Destination           Protocol Length Info
     61 0.000148       220.28.114.28         215.158.114.171       TCP      1454   443 → 52924 [ACK] Seq=30757 Ack=1 Win=136 Len=1398 TSval=1514554313 TSecr=3278401698

Frame 61: 1454 bytes on wire (11632 bits), 52 bytes captured (416 bits)
Raw packet data
Internet Protocol Version 4, Src: 220.28.114.28, Dst: 215.158.114.171
Transmission Control Protocol, Src Port: 443 (443), Dst Port: 52924 (52924), Seq: 30757, Ack: 1, Len: 1398

No.     Time           Source                Destination           Protocol Length Info
     62 0.000150       136.114.101.65        8.181.143.186         TCP      1504   443 → 48792 [ACK] Seq=9170 Ack=1 Win=1320 Len=1448 TSval=3744963697 TSecr=1721843084

Frame 62: 1504 bytes on wire (12032 bits), 52 bytes captured (416 bits)
Raw packet data
Internet Protocol Version 4, Src: 136.114.101.65, Dst: 8.181.143.186
Transmission Control Protocol, Src Port: 443 (443), Dst Port: 48792 (48792), Seq: 9170, Ack: 1, Len: 1448

No.     Time           Source                Destination           Protocol Length Info
     63 0.000151       100.50.100.161        8.176.5.89            TCP      371    1935 → 12002 [PSH, ACK] Seq=1 Ack=1 Win=65535 Len=315 TSval=42462571 TSecr=46456109

Frame 63: 371 bytes on wire (2968 bits), 52 bytes captured (416 bits)
Raw packet data
Internet Protocol Version 4, Src: 100.50.100.161, Dst: 8.176.5.89
Transmission Control Protocol, Src Port: 1935 (1935), Dst Port: 12002 (12002), Seq: 1, Ack: 1, Len: 315

No.     Time           Source                Destination           Protocol Length Info
     64 0.000152       7b7f:80fe:f:ff38::    ce7c:ff01:81f0:cf::   ICMPv6   72     Router Solicitation

Frame 64: 72 bytes on wire (576 bits), 68 bytes captured (544 bits)
Raw packet data
Internet Protocol Version 4, Src: 220.250.162.225, Dst: 109.209.85.122
Internet Protocol Version 6, Src: 7b7f:80fe:f:ff38::, Dst: ce7c:ff01:81f0:cf::
Internet Control Message Protocol v6

No.     Time           Source                Destination           Protocol Length Info
     65 0.000160       136.114.101.65        8.181.143.186         TCP      1504   443 → 48792 [ACK] Seq=10618 Ack=1 Win=1320 Len=1448 TSval=3744963697 TSecr=1721843084

Frame 65: 1504 bytes on wire (12032 bits), 52 bytes captured (416 bits)
Raw packet data
Internet Protocol Version 4, Src: 136.114.101.65, Dst: 8.181.143.186
Transmission Control Protocol, Src Port: 443 (443), Dst Port: 48792 (48792), Seq: 10618, Ack: 1, Len: 1448

No.     Time           Source                Destination           Protocol Length Info
     66 0.000164       145.253.5.46          50.224.90.182         TCP      1357   51663 → 443 [PSH, ACK] Seq=1 Ack=1 Win=181 Len=1301 TSval=330629453 TSecr=2716576562

Frame 66: 1357 bytes on wire (10856 bits), 52 bytes captured (416 bits)
Raw packet data
Internet Protocol Version 4, Src: 145.253.5.46, Dst: 50.224.90.182
Transmission Control Protocol, Src Port: 51663 (51663), Dst Port: 443 (443), Seq: 1, Ack: 1, Len: 1301

No.     Time           Source                Destination           Protocol Length Info
     67 0.000166       220.28.114.28         215.158.114.171       TCP      1454   443 → 52924 [ACK] Seq=32155 Ack=1 Win=136 Len=1398 TSval=1514554313 TSecr=3278401698

Frame 67: 1454 bytes on wire (11632 bits), 52 bytes captured (416 bits)
Raw packet data
Internet Protocol Version 4, Src: 220.28.114.28, Dst: 215.158.114.171
Transmission Control Protocol, Src Port: 443 (443), Dst Port: 52924 (52924), Seq: 32155, Ack: 1, Len: 1398

No.     Time           Source                Destination           Protocol Length Info
     68 0.000169       139.69.162.23         8.181.142.35          TCP      1504   443 → 53716 [ACK] Seq=1568 Ack=1 Win=1320 Len=1448 TSval=3108203720 TSecr=3655029580

Frame 68: 1504 bytes on wire (12032 bits), 52 bytes captured (416 bits)
Raw packet data
Internet Protocol Version 4, Src: 139.69.162.23, Dst: 8.181.142.35
Transmission Control Protocol, Src Port: 443 (443), Dst Port: 53716 (53716), Seq: 1568, Ack: 1, Len: 1448

No.     Time           Source                Destination           Protocol Length Info
     69 0.000171       139.69.162.23         8.181.142.35          TCP      133    443 → 53716 [PSH, ACK] Seq=3016 Ack=1 Win=1320 Len=77 TSval=3108203720 TSecr=3655029580

Frame 69: 133 bytes on wire (1064 bits), 52 bytes captured (416 bits)
Raw packet data
Internet Protocol Version 4, Src: 139.69.162.23, Dst: 8.181.142.35
Transmission Control Protocol, Src Port: 443 (443), Dst Port: 53716 (53716), Seq: 3016, Ack: 1, Len: 77

No.     Time           Source                Destination           Protocol Length Info
     70 0.000171       77.42.91.10           103.36.205.87         TCP      46     55819 → 52922 [ACK] Seq=1 Ack=1 Win=16383 Len=0

Frame 70: 46 bytes on wire (368 bits), 40 bytes captured (320 bits)
Raw packet data
Internet Protocol Version 4, Src: 77.42.91.10, Dst: 103.36.205.87
Transmission Control Protocol, Src Port: 55819 (55819), Dst Port: 52922 (52922), Seq: 1, Ack: 1, Len: 0

No.     Time           Source                Destination           Protocol Length Info
     71 0.000171       53.68.4.87            247.136.242.57        TCP      46     80 → 2223 [ACK] Seq=1 Ack=1 Win=20440 Len=0

Frame 71: 46 bytes on wire (368 bits), 40 bytes captured (320 bits)
Raw packet data
Internet Protocol Version 4, Src: 53.68.4.87, Dst: 247.136.242.57
Transmission Control Protocol, Src Port: 80 (80), Dst Port: 2223 (2223), Seq: 1, Ack: 1, Len: 0

No.     Time           Source                Destination           Protocol Length Info
     72 0.000171       153.175.188.200       109.91.50.218         UDP      322    1900 → 27015  Len=290[Packet size limited during capture]

Frame 72: 322 bytes on wire (2576 bits), 28 bytes captured (224 bits)
Raw packet data
Internet Protocol Version 4, Src: 153.175.188.200, Dst: 109.91.50.218
User Datagram Protocol, Src Port: 1900 (1900), Dst Port: 27015 (27015)
[Packet size limited during capture: HTTP truncated]

No.     Time           Source                Destination           Protocol Length Info
     73 0.000171       68.202.113.225        50.224.90.254         TCP      1504   40997 → 443 [ACK] Seq=1 Ack=1 Win=137 Len=1448 TSval=2737723439 TSecr=2716576409

Frame 73: 1504 bytes on wire (12032 bits), 52 bytes captured (416 bits)
Raw packet data
Internet Protocol Version 4, Src: 68.202.113.225, Dst: 50.224.90.254
Transmission Control Protocol, Src Port: 40997 (40997), Dst Port: 443 (443), Seq: 1, Ack: 1, Len: 1448

No.     Time           Source                Destination           Protocol Length Info
     74 0.000173       136.114.101.65        8.181.143.186         TCP      1504   443 → 48792 [ACK] Seq=12066 Ack=1 Win=1320 Len=1448 TSval=3744963697 TSecr=1721843084

Frame 74: 1504 bytes on wire (12032 bits), 52 bytes captured (416 bits)
Raw packet data
Internet Protocol Version 4, Src: 136.114.101.65, Dst: 8.181.143.186
Transmission Control Protocol, Src Port: 443 (443), Dst Port: 48792 (48792), Seq: 12066, Ack: 1, Len: 1448

No.     Time           Source                Destination           Protocol Length Info
     75 0.000174       220.28.114.28         215.158.114.171       TCP      1454   443 → 52924 [ACK] Seq=33553 Ack=1 Win=136 Len=1398 TSval=1514554313 TSecr=3278401698

Frame 75: 1454 bytes on wire (11632 bits), 52 bytes captured (416 bits)
Raw packet data
Internet Protocol Version 4, Src: 220.28.114.28, Dst: 215.158.114.171
Transmission Control Protocol, Src Port: 443 (443), Dst Port: 52924 (52924), Seq: 33553, Ack: 1, Len: 1398

No.     Time           Source                Destination           Protocol Length Info
     76 0.000175       136.114.101.65        8.181.143.186         TCP      494    443 → 48792 [PSH, ACK] Seq=13514 Ack=1 Win=1320 Len=438 TSval=3744963697 TSecr=1721843084

Frame 76: 494 bytes on wire (3952 bits), 52 bytes captured (416 bits)
Raw packet data
Internet Protocol Version 4, Src: 136.114.101.65, Dst: 8.181.143.186
Transmission Control Protocol, Src Port: 443 (443), Dst Port: 48792 (48792), Seq: 13514, Ack: 1, Len: 438

No.     Time           Source                Destination           Protocol Length Info
     77 0.000176       220.28.114.28         215.158.114.171       TCP      1454   443 → 52924 [ACK] Seq=34951 Ack=1 Win=136 Len=1398 TSval=1514554313 TSecr=3278401698

Frame 77: 1454 bytes on wire (11632 bits), 52 bytes captured (416 bits)
Raw packet data
Internet Protocol Version 4, Src: 220.28.114.28, Dst: 215.158.114.171
Transmission Control Protocol, Src Port: 443 (443), Dst Port: 52924 (52924), Seq: 34951, Ack: 1, Len: 1398

No.     Time           Source                Destination           Protocol Length Info
